Clone ID,Mating Type /Het /Hom,Rec Number,SystematicName,SGD ID,Gene ID,Gene Symbol,Gene Description,SGD Description,transOMIC PRC
MATa-YLR359W,Mat-a,25268,YLR359W,S000004351,851073,ADE13,"Adenylosuccinate lyase, catalyzes two steps in the 'de novo' purine nucleotide biosynthetic pathway; expression is repressed by adenine and activated by Bas1p and Pho2p; mutations in human ortholog ADSL cause adenylosuccinase deficiency",NA,9 C_10
MATa-YLR378C,Mat-a,25287,YLR378C,S000004370,851095,SEC61,"Essential subunit of Sec61 complex (Sec61p, Sbh1p, and Sss1p); forms a channel for SRP-dependent protein import and retrograde transport of misfolded proteins out of the ER; with Sec63 complex allows SRP-independent protein import into ER",NA,9 C_11
MATa-YLR379W,Mat-a,25288,YLR379W,NA,NA,NA,NA,"Dubious open reading frame; unlikely to encode a functional protein, based on available experimental and comparative sequence data; partially overlaps the essential ORF SEC61/YLR378C",9 C_12
MATa-YLR397C,Mat-a,25306,YLR397C,S000004389,851113,AFG2,"ATPase of the CDC48/PAS1/SEC18 (AAA) family, forms a hexameric complex; is essential for pre-60S maturation and release of several preribosome maturation factors; releases Rlp24p from purified pre-60S particles in vitro; may be involved in degradation of aberrant mRNAs",NA,9 D_1
MATa-YLR409C,Mat-a,25318,YLR409C,S000004401,851125,UTP21,Subunit of U3-containing 90S preribosome and Small Subunit (SSU) processome complexes involved in production of 18S rRNA and assembly of small ribosomal subunit; synthetic defect with STI1 Hsp90 cochaperone; human homolog linked to glaucoma,NA,9 D_2
MATa-YLR424W,Mat-a,26027,YLR424W,S000004416,851143,SPP382,"Essential protein that forms a dimer with Ntr2p; also forms a trimer, with Ntr2p and Prp43p, that is involved in spliceosome disassembly; found also in a multisubunit complex with the splicing factor Clf1p; suppressor of prp38-1 mutation",NA,9 D_3
MATa-YLR440C,Mat-a,26044,YLR440C,S000004432,851161,SEC39,Component of the Dsl1p tethering complex that interacts with ER SNAREs Sec20p and Use1p; proposed to be involved in protein secretion; localizes to the ER and nuclear envelope,NA,9 D_5
MATa-YLR457C,Mat-a,27112,YLR457C,S000004449,851180,NBP1,"Spindle pole body (SPB) component; required for the insertion of the duplication plaque into the nuclear membrane during SPB duplication; essential for bipolar spindle formation; component of the Mps2p-Bbp1p complex; NBP1 has a paralog, YPR174C, that arose from the whole genome duplication",NA,9 D_6
MATa-YLR458W,Mat-a,26061,YLR458W,NA,NA,NA,NA,"Dubious open reading frame; unlikely to encode a functional protein, based on available experimental and comparative sequence data; overlaps 5' end of essential NBP1 gene required for mitosis",9 D_7
MATa-YML010W,Mat-a,20564,YML010W,S000004470,854999,SPT5,"Component of the universally conserved Spt4/5 complex (DSIF complex); the complex has multiple roles in concert with RNA polymerases I and II, including regulation of transcription elongation, RNA processing, quality control, and transcription-coupled DNA repair",NA,9 D_9
MATa-YML023C,Mat-a,NA,YML023C,NA,NA,YML023C,NA,NA,9 D_10
MATa-YML025C,Mat-a,20548,YML025C,S000004487,854983,YML6,"Mitochondrial ribosomal protein of the large subunit, has similarity to E. coli L4 ribosomal protein and human mitoribosomal MRP-L4 protein; essential for viability, unlike most other mitoribosomal proteins",NA,9 D_11
MATa-YML031W,Mat-a,26949,YML031W,S000004493,854977,NDC1,"Subunit of the transmembrane ring of the nuclear pore complex (NPC); contributes to nucleocytoplasmic transport, NPC biogenesis and spindle pole body duplication; homologous to human NDC1",NA,9 D_12
MATa-YML064C,Mat-a,20506,YML064C,S000004529,854938,TEM1,GTP-binding protein of the ras superfamily involved in termination of M-phase; controls actomyosin and septin dynamics during cytokinesis,NA,9 E_2
MATa-YML065W,Mat-a,20505,YML065W,S000004530,854937,ORC1,"Largest subunit of the origin recognition complex; involved in directing DNA replication by binding to replication origins; also involved in transcriptional silencing; exhibits ATPase activity; ORC1 has a paralog, SIR3, that arose from the whole genome duplication",NA,9 E_3
MATa-YML069W,Mat-a,27114,YML069W,S000004534,854933,POB3,"Subunit of the heterodimeric FACT complex (Spt16p-Pob3p); FACT associates with chromatin via interaction with Nhp6Ap and Nhp6Bp, and reorganizes nucleosomes to facilitate access to DNA by RNA and DNA polymerases; protein abundance increases in response to DNA replication stress",NA,9 E_4
MATa-YML077W,Mat-a,26735,YML077W,S000004542,854898,BET5,"Component of the TRAPP (transport protein particle) complex, which plays an essential role in the vesicular transport from endoplasmic reticulum to Golgi",NA,9 E_5
MATa-YML091C,Mat-a,26488,YML091C,S000004556,854883,RPM2,"Protein subunit of mitochondrial RNase P, has roles in nuclear transcription, cytoplasmic and mitochondrial RNA processing, and mitochondrial translation; distributed to mitochondria, cytoplasmic processing bodies, and the nucleus",NA,9 E_6
MATa-YML093W,Mat-a,26490,YML093W,S000004558,854881,UTP14,Subunit of U3-containing Small Subunit (SSU) processome complex involved in production of 18S rRNA and assembly of small ribosomal subunit,NA,9 E_7
MATa-YML125C,Mat-a,NA,YML125C,NA,NA,YML125C,NA,NA,9 E_9
MATa-YML126C,Mat-a,26527,YML126C,S000004595,854913,ERG13,"3-hydroxy-3-methylglutaryl-CoA (HMG-CoA) synthase, catalyzes the formation of HMG-CoA from acetyl-CoA and acetoacetyl-CoA; involved in the second step in mevalonate biosynthesis",NA,9 E_10
MATa-YMR001C,Mat-a,20576,YMR001C,S000004603,855013,CDC5,"Polo-like kinase with multiple functions in mitosis and cytokinesis through substrate phosphorylation, also functions in adaptation to DNA damage during meiosis; has similarity to Xenopus Plx1 and S. pombe Plo1p; possible Cdc28p substrate",NA,9 F_1
MATa-YMR013C,Mat-a,20588,YMR013C,S000004615,855026,SEC59,"Dolichol kinase, catalyzes the terminal step in dolichyl monophosphate (Dol-P) biosynthesis; required for viability and for normal rates of lipid intermediate synthesis and protein N-glycosylation",NA,9 F_2
MATa-YMR028W,Mat-a,20603,YMR028W,S000004630,855043,TAP42,Essential protein involved in the TOR signaling pathway; physically associates with the protein phosphatase 2A and the SIT4 protein phosphatase catalytic subunits,NA,9 F_3
MATa-YMR047C,Mat-a,20623,YMR047C,S000004650,855066,NUP116,"FG-nucleoporin component of central core of the nuclear pore complex (NPC); contributes directly to nucleocytoplasmic transport and maintenance of the NPC permeability barrier; forms a stable association with Nup82p, Gle2p and two other FG-nucleoporins (Nsp1p and Nup159p); NUP116 has a paralog, NUP100, that arose from the whole genome duplication",NA,9 F_4
MATa-YMR049C,Mat-a,26184,YMR049C,S000004652,855068,ERB1,"Constituent of 66S pre-ribosomal particles, forms a complex with Nop7p and Ytm1p that is required for maturation of the large ribosomal subunit; required for maturation of the 25S and 5.8S ribosomal RNAs; homologous to mammalian Bop1",NA,9 F_5
MATa-YMR059W,Mat-a,26193,YMR059W,S000004663,855081,SEN15,"Subunit of the tRNA splicing endonuclease, which is composed of Sen2p, Sen15p, Sen34p, and Sen54p",NA,9 F_6
MATa-YMR093W,Mat-a,26228,YMR093W,S000004699,855118,UTP15,"Nucleolar protein, component of the small subunit (SSU) processome containing the U3 snoRNA that is involved in processing of pre-18S rRNA",NA,9 F_9
MATa-YMR094W,Mat-a,26534,YMR094W,S000004700,855119,CTF13,"Subunit of the CBF3 complex, which binds to the CDE III element of centromeres, bending the DNA upon binding, and may be involved in sister chromatid cohesion during mitosis",NA,9 F_10
MATa-YMR112C,Mat-a,26552,YMR112C,S000004718,855139,MED11,Subunit of the RNA polymerase II mediator complex; associates with core polymerase subunits to form the RNA polymerase II holoenzyme; essential protein,NA,9 F_11
MATa-YMR113W,Mat-a,26553,YMR113W,S000004719,855140,FOL3,"Dihydrofolate synthetase, involved in folic acid biosynthesis; catalyzes conversion of dihydropteroate to dihydrofolate in folate coenzyme biosynthesis; FOL3 has a paralog, RMA1, that arose from the whole genome duplication",NA,9 F_12
MATa-YMR117C,Mat-a,26557,YMR117C,S000004723,855144,SPC24,"Component of the evolutionarily conserved kinetochore-associated Ndc80 complex (Ndc80p-Nuf2p-Spc24p-Spc25p); involved in chromosome segregation, spindle checkpoint activity and kinetochore clustering",NA,9 G_1
MATa-YMR128W,Mat-a,26569,YMR128W,S000004735,855158,ECM16,"Essential DEAH-box ATP-dependent RNA helicase specific to the U3 snoRNP, predominantly nucleolar in distribution, required for 18S rRNA synthesis",NA,9 G_2
MATa-YMR131C,Mat-a,26572,YMR131C,S000004738,855161,RRB1,Essential nuclear protein involved in early steps of ribosome biogenesis; physically interacts with the ribosomal protein Rpl3p,NA,9 G_3
MATa-YMR134W,Mat-a,26575,YMR134W,S000004741,855164,YMR134W,Protein of unknown function that may be involved in iron metabolism; mutant bm-8 has a growth defect on iron-limited medium that is complemented by overexpression of Yfh1p; shows localization to the ER; highly conserved in ascomycetes,NA,9 G_4
MATa-YMR149W,Mat-a,20730,YMR149W,S000004757,855180,SWP1,"Delta subunit of the oligosaccharyl transferase glycoprotein complex, which is required for N-linked glycosylation of proteins in the endoplasmic reticulum",NA,9 G_5
MATa-YMR168C,Mat-a,20751,YMR168C,S000004778,855204,CEP3,"Essential kinetochore protein, component of the CBF3 complex that binds the CDEIII region of the centromere; contains an N-terminal Zn2Cys6 type zinc finger domain, a C-terminal acidic domain, and a putative coiled coil dimerization domain",NA,9 G_6
MATa-YMR200W,Mat-a,20786,YMR200W,S000004813,855240,ROT1,"Molecular chaperone involved in protein folding in the ER; mutation causes defects in cell wall synthesis and in lysis of autophagic bodies, suppresses tor2 mutations, and is synthetically lethal with kar2-1 and with rot2 mutations; involved in N-linked glycosylation and O-mannosylation",NA,9 G_8
MATa-YMR208W,Mat-a,20794,YMR208W,S000004821,855248,ERG12,"Mevalonate kinase, acts in the biosynthesis of isoprenoids and sterols, including ergosterol, from mevalonate",NA,9 G_9
MATa-YMR211W,Mat-a,20797,YMR211W,S000004824,855251,DML1,"Essential protein involved in mtDNA inheritance, may also function in the partitioning of the mitochondrial organelle or in the segregation of chromosomes, exhibits regions similar to members of a GTPase family",NA,9 G_10
MATa-YMR213W,Mat-a,20799,YMR213W,S000004826,855253,CEF1,"Essential splicing factor; associated with Prp19p and the spliceosome, contains an N-terminal c-Myb DNA binding motif necessary for cell viability but not for Prp19p association, evolutionarily conserved and homologous to S. pombe Cdc5p",NA,9 G_11
MATa-YMR218C,Mat-a,20804,YMR218C,S000004831,855258,TRS130,One of 10 subunits of the transport protein particle (TRAPP) complex of the cis-Golgi which mediates vesicle docking and fusion; involved in ER to Golgi membrane traffic; mutation activates transcription of OCH1; mutants are defective in cytoplasm-to-vacuole targeting (Cvt) pathway and starvation-induced autophagy,NA,9 G_12
MATa-YMR220W,Mat-a,20806,YMR220W,S000004833,855260,ERG8,"Phosphomevalonate kinase, an essential cytosolic enzyme that acts in the biosynthesis of isoprenoids and sterols, including ergosterol, from mevalonate",NA,9 H_1
MATa-YMR229C,Mat-a,20815,YMR229C,S000004842,855269,RRP5,RNA binding protein involved in synthesis of both 18S and 5.8S rRNAs; component of both the ribosomal small subunit (SSU) processosome and the 90S preribosome; has binding preference for single stranded tracts of U's; relocalizes from nucleolus to nucleus upon DNA replication stress,NA,9 H_2
MATa-YMR235C,Mat-a,20821,YMR235C,S000004848,855275,RNA1,"GTPase activating protein (GAP) for Gsp1p, involved in nuclear transport",NA,9 H_3
MATa-YMR236W,Mat-a,20822,YMR236W,S000004849,855276,TAF9,"Subunit (17 kDa) of TFIID and SAGA complexes, involved in RNA polymerase II transcription initiation and in chromatin modification, similar to histone H3",NA,9 H_4
MATa-YMR240C,Mat-a,20826,YMR240C,S000004853,855281,CUS1,"Protein required for assembly of U2 snRNP into the spliceosome, forms a complex with Hsh49p and Hsh155p",NA,9 H_5
MATa-YMR260C,Mat-a,20846,YMR260C,S000004873,855302,TIF11,"Translation initiation factor eIF1A, essential protein that forms a complex with Sui1p (eIF1) and the 40S ribosomal subunit and scans for the start codon; C-terminus associates with Fun12p (eIF5B); N terminus interacts with eIF2 and eIF3",NA,9 H_6
MATa-YMR268C,Mat-a,20854,YMR268C,S000004881,855310,PRP24,Splicing factor that reanneals U4 and U6 snRNPs during spliceosome recycling,NA,9 H_7
MATa-YMR281W,Mat-a,20867,YMR281W,S000004894,855324,GPI12,"ER membrane protein involved in the second step of glycosylphosphatidylinositol (GPI) anchor assembly, the de-N-acetylation of the N-acetylglucosaminylphosphatidylinositol intermediate; functional homolog of human PIG-Lp",NA,9 H_8
MATa-YMR288W,Mat-a,20874,YMR288W,S000004901,855332,HSH155,U2-snRNP associated splicing factor that forms extensive associations with the branch site-3' splice site-3' exon region upon prespliceosome formation; similarity to the mammalian U2 snRNP-associated splicing factor SAP155,NA,9 H_9
MATa-YMR290C,Mat-a,20877,YMR290C,S000004903,855335,HAS1,ATP-dependent RNA helicase; localizes to both the nuclear periphery and nucleolus; highly enriched in nuclear pore complex fractions; constituent of 66S pre-ribosomal particles,NA,9 H_10
MATa-YMR298W,Mat-a,NA,YMR298W,NA,NA,YMR298W,NA,NA,9 H_12
MATa-YMR301C,Mat-a,20889,YMR301C,S000004916,855347,ATM1,"Mitochondrial inner membrane ATP-binding cassette (ABC) transporter, exports mitochondrially synthesized precursors of iron-sulfur (Fe/S) clusters to the cytosol",NA,10 A_1
MATa-YMR308C,Mat-a,20898,YMR308C,S000004925,855356,PSE1,"Karyopherin/importin that interacts with the nuclear pore complex; acts as the nuclear import receptor for specific proteins, including Pdr1p, Yap1p, Ste12p, and Aft1p",NA,10 A_2
MATa-YMR309C,Mat-a,20899,YMR309C,S000004926,855357,NIP1,"eIF3c subunit of the eukaryotic translation initiation factor 3 (eIF3), involved in the assembly of preinitiation complex and start codon selection",NA,10 A_3
MATa-YMR314W,Mat-a,26454,YMR314W,S000004931,855362,PRE5,Alpha 6 subunit of the 20S proteasome; protein abundance increases in response to DNA replication stress,NA,10 A_4
MATa-YNL088W,Mat-a,22988,YNL088W,S000005032,855636,TOP2,"Topoisomerase II, relieves torsional strain in DNA by cleaving and re-sealing the phosphodiester backbone of both positively and negatively supercoiled DNA; cleaves complementary strands; localizes to axial cores in meiosis; required for replication slow zone (RSZ) breakage following Mec1p inactivation",NA,10 A_11
MATa-YNL102W,Mat-a,22974,YNL102W,S000005046,855621,POL1,"Catalytic subunit of the DNA polymerase I alpha-primase complex, required for the initiation of DNA replication during mitotic DNA synthesis and premeiotic DNA synthesis",NA,10 A_12
MATa-YNL110C,Mat-a,22966,YNL110C,S000005054,855613,NOP15,"Constituent of 66S pre-ribosomal particles, involved in 60S ribosomal subunit biogenesis; localizes to both nucleolus and cytoplasm",NA,10 B_2
MATa-YNL112W,Mat-a,22964,YNL112W,S000005056,855611,DBP2,"ATP-dependent RNA helicase of the DEAD-box protein family; has a strong preference for dsRNA; interacts with YRA1; required for the assembly of Yra1p, Nab2p and Mex67p onto mRNA and formation of nuclear mRNP; involved in mRNA decay and rRNA processing; may be involved in suppression of transcription from cryptic initiation sites",NA,10 B_3
MATa-YNL124W,Mat-a,22952,YNL124W,S000005068,855599,NAF1,"RNA-binding protein required for the assembly of box H/ACA snoRNPs and thus for pre-rRNA processing, forms a complex with Shq1p and interacts with H/ACA snoRNP components Nhp2p and Cbf5p; similar to Gar1p",NA,10 B_7
MATa-YNL126W,Mat-a,22950,YNL126W,S000005070,855597,SPC98,Component of the microtubule-nucleating Tub4p (gamma-tubulin) complex; interacts with Spc110p at the spindle pole body (SPB) inner plaque and with Spc72p at the SPB outer plaque,NA,10 B_8
MATa-YNL131W,Mat-a,22945,YNL131W,S000005075,855592,TOM22,Component of the TOM (translocase of outer mitochondrial membrane) complex responsible for initial import of mitochondrially directed proteins; acts as a receptor for precursor proteins and mediates interaction between TOM and TIM complexes,NA,10 B_9
MATa-YNL132W,Mat-a,22944,YNL132W,S000005076,855591,KRE33,"Essential protein, required for biogenesis of the small ribosomal subunit; heterozygous mutant shows haploinsufficiency in K1 killer toxin resistance",NA,10 B_10
MATa-YNL137C,Mat-a,27248,YNL137C,S000005081,855585,NAM9,Mitochondrial ribosomal component of the small subunit,NA,10 B_11
MATa-YNL158W,Mat-a,NA,YNL158W,NA,NA,YNL158W,NA,NA,10 C_4
MATa-YNL161W,Mat-a,22051,YNL161W,S000005105,855561,CBK1,"Serine/threonine protein kinase of the the RAM signaling network; Ndr/LATS family member; binds regulatory subunit Mob2p; involved in regulation of cellular morphogenesis, polarized growth, and septum destruction; phosphorylation by Cbk1p regulates localization and activity of Ace2p transcription factor and Ssd1p translational repressor; Cbk1p activity is regulated by both phosphorylation and specific localization; relocalizes to cytoplasm upon DNA replication stress",NA,10 C_5
MATa-YNL162W,Mat-a,NA,YNL162W,NA,NA,RPL42A,NA,NA,10 C_6
MATa-YNL163C,Mat-a,22049,YNL163C,S000005107,855558,RIA1,"Cytoplasmic GTPase/eEF2-like factor involved in ribosomal biogenesis; with Sdo1p, promotes release of Tif6p from 60S ribosomal subunits in the cytoplasm so that they can assemble with 40S subunits to generate mature ribosomes; required for quality control check of newly made large ribosomal subunits before they are released into the pool of translating ribosomes",NA,10 C_7
MATa-YNL172W,Mat-a,22040,YNL172W,S000005116,855549,APC1,"Largest subunit of the Anaphase-Promoting Complex/Cyclosome; APC/C is a ubiquitin-protein ligase required for degradation of anaphase inhibitors, including mitotic cyclins, during the metaphase/anaphase transition; component of the platform domain of the APC/C, based on structural analysis; localizes to nuclear foci that become diffuse upon DNA replication stress",NA,10 C_8
MATa-YNL181W,Mat-a,22031,YNL181W,S000005125,855540,YNL181W,Putative oxidoreductase; required for cell viability,NA,10 C_10
MATa-YNL182C,Mat-a,22030,YNL182C,S000005126,855539,IPI3,Component of the Rix1 complex (Rix1p-Ipi1p-Ipi3p) and pre-replicative complexes (pre-RCs); required for processing of ITS2 sequences from 35S pre-rRNA; component of the pre-60S ribosomal particle with the dynein-related AAA-type ATPase Mdn1p; required for pre-RC formation and maintenance during DNA replication licensing; highly conserved protein which contains several WD40 motifs; IPI3 is an essential gene,NA,10 C_11
MATa-YNL207W,Mat-a,22005,YNL207W,S000005151,855514,RIO2,Essential serine kinase involved in the processing of the 20S pre-rRNA into mature 18S rRNA; has similarity to Rio1p,NA,10 C_12
MATa-YNL216W,Mat-a,21996,YNL216W,S000005160,855505,RAP1,"Essential DNA-binding transcription regulator that binds many loci; involved in transcription activation and repression, chromatin silencing, and telomere length maintenance; relocalizes to the cytosol in response to hypoxia; conserved protein with an N-terminal BRCT domain, a central region with homology to the Myb DNA binding domain, and a C-terminal Rap1-specific protein-interaction domain (RCT domain)",NA,10 D_1
MATa-YNL222W,Mat-a,21990,YNL222W,S000005166,855499,SSU72,Phosphatase and transcription/RNA-processing factor; associates with TFIIB and cleavage/polyadenylation factor Pta1p; exhibits phosphatase activity on serine-5 and serine-7 of the RNA polymerase II C-terminal domain; affects start site selection and transcriptional read through in vivo,NA,10 D_2
MATa-YNL240C,Mat-a,21972,YNL240C,S000005184,855481,NAR1,"Component of the cytosolic iron-sulfur (FeS) protein assembly machinery, required for maturation of cytosolic and nuclear FeS proteins and for normal resistance to oxidative stress; homologous to human Narf",NA,10 D_4
MATa-YNL244C,Mat-a,26463,YNL244C,S000005188,855477,SUI1,Translation initiation factor eIF1; component of a complex involved in recognition of the initiator codon; modulates translation accuracy at the initiation phase,NA,10 D_5
MATa-YNL245C,Mat-a,21199,YNL245C,S000005189,855476,CWC25,Splicing factor required for the first step of pre-mRNA splicing; binding to the spliceosome requires Prp2p and Yju2p; heat-stable protein; has similarity to S. pombe Cwf25p,NA,10 D_6
MATa-YNL247W,Mat-a,21197,YNL247W,S000005191,855474,YNL247W,"Cysteinyl-tRNA synthetase; may interact with ribosomes, based on co-purification experiments",NA,10 D_7
MATa-YNL256W,Mat-a,26466,YNL256W,S000005200,855465,FOL1,"Multifunctional enzyme of the folic acid biosynthesis pathway, has dihydropteroate synthetase, dihydro-6-hydroxymethylpterin pyrophosphokinase, and dihydroneopterin aldolase activities",NA,10 D_8
MATa-YNL258C,Mat-a,21186,YNL258C,S000005202,855463,DSL1,Peripheral membrane protein needed for Golgi-to-ER retrograde traffic; forms a complex with Sec39p and Tip20p that interacts with ER SNAREs Sec20p and Use1p; component of the ER target site that interacts with coatomer; interacts with Cin5p; similar to the fly and human ZW10 gene,NA,10 D_9
MATa-YNL260C,Mat-a,NA,YNL260C,NA,NA,YNL260C,NA,NA,10 D_10
MATa-YNL262W,Mat-a,21182,YNL262W,S000005206,855459,POL2,"Catalytic subunit of DNA polymerase (II) epsilon, a chromosomal DNA replication polymerase that exhibits processivity and proofreading exonuclease activity; also involved in DNA synthesis during DNA repair; interacts extensively with Mrc1p",NA,10 D_11
MATa-YNL263C,Mat-a,21181,YNL263C,S000005207,855458,YIF1,"Integral membrane protein required for the fusion of ER-derived COPII transport vesicles with the Golgi; interacts with Yip1p and Yos1p; localizes to the Golgi, the ER, and COPII vesicles; homolog of human YIPF3",NA,10 D_12
MATa-YNL267W,Mat-a,26958,YNL267W,S000005211,855454,PIK1,"Phosphatidylinositol 4-kinase; catalyzes first step in the biosynthesis of phosphatidylinositol-4,5-biphosphate; may control cytokinesis through the actin cytoskeleton",NA,10 E_1
MATa-YNL290W,Mat-a,21154,YNL290W,S000005234,855426,RFC3,Subunit of heteropentameric Replication factor C (RF-C); which is a DNA binding protein and ATPase that acts as a clamp loader of the proliferating cell nuclear antigen (PCNA) processivity factor for DNA polymerases delta and epsilon; relocalizes to the cytosol in response to hypoxia,NA,10 E_5
MATa-YNL306W,Mat-a,21138,YNL306W,S000005250,855410,MRPS18,"Mitochondrial ribosomal protein of the small subunit; essential for viability, unlike most other mitoribosomal proteins",NA,10 E_6
MATa-YNL308C,Mat-a,21136,YNL308C,S000005252,855408,KRI1,Essential nucleolar protein required for 40S ribosome biogenesis; associate with snR30; physically and functionally interacts with Krr1p,NA,10 E_7
MATa-YNL310C,Mat-a,21134,YNL310C,S000005254,855406,ZIM17,Heat shock protein with a zinc finger motif; essential for protein import into mitochondria; may act with Pam18p to facilitate recognition and folding of imported proteins by Ssc1p (mtHSP70) in the mitochondrial matrix,NA,10 E_8
MATa-YNL313C,Mat-a,NA,YNL313C,NA,NA,YNL313C,NA,NA,10 E_10
MATa-YNR003C,Mat-a,25378,YNR003C,S000005286,855737,RPC34,RNA polymerase III subunit C34; interacts with TFIIIB70 and is a key determinant in pol III recruitment by the preinitiation complex,NA,10 E_12
MATa-YNR017W,Mat-a,NA,YNR017W,NA,NA,MAS6,NA,NA,10 F_2
MATa-YNR026C,Mat-a,25401,YNR026C,S000005309,855760,SEC12,"Guanine nucleotide exchange factor (GEF); activates Sar1p by catalyzing the exchange of GDP for GTP; required for the initiation of COPII vesicle formation in ER to Golgi transport; glycosylated integral membrane protein of the ER; SEC12 has a paralog, SED4, that arose from the whole genome duplication",NA,10 F_3
MATa-YNR038W,Mat-a,25413,YNR038W,S000005321,855774,DBP6,Essential protein involved in ribosome biogenesis; putative ATP-dependent RNA helicase of the DEAD-box protein family,NA,10 F_4
MATa-YNR046W,Mat-a,NA,YNR046W,NA,NA,YNR046W,NA,NA,10 F_5
MATa-YNR054C,Mat-a,26081,YNR054C,S000005337,855790,ESF2,Essential nucleolar protein involved in pre-18S rRNA processing; binds to RNA and stimulates ATPase activity of Dbp8; involved in assembly of the small subunit (SSU) processome,NA,10 F_6
MATa-YOL010W,Mat-a,21701,YOL010W,S000005370,854152,RCL1,Endonuclease that cleaves pre-rRNA at site A2 for 18S rRNA biogenesis; subunit of U3-containing 90S preribosome processome complex involved in small ribosomal subunit assembly; stimulates Bms1p GTPase and U3 binding activity; similar to RNA cyclase-like proteins but no cyclase activity detected,NA,10 F_8
MATa-YOL021C,Mat-a,21712,YOL021C,S000005381,854138,DIS3,Exosome core complex catalytic subunit; possesses both endonuclease and 3'-5' exonuclease activity; involved in 3'-5' RNA processing and degradation in both the nucleus and the cytoplasm; has similarity to E. coli RNase R and to human DIS3; protein abundance increases in response to DNA replication stress,NA,10 F_9
MATa-YOL022C,Mat-a,NA,YOL022C,NA,NA,YOL022C,NA,NA,10 F_10
