Clone ID,Mating Type /Het /Hom,Rec Number,SystematicName,SGD ID,Gene ID,Gene Symbol,Gene Description,SGD Description,transOMIC PRC
MATa-YAL025C,Mat-a,20383,YAL025C,S000000023,851208,MAK16,"Essential nuclear protein, constituent of 66S pre-ribosomal particles; required for maturation of 25S and 5.8S rRNAs; required for maintenance of M1 satellite double-stranded RNA of the L-A virus",NA,1 A_1
MATa-YBL097W,Mat-a,23123,YBL097W,S000000193,852180,BRN1,Subunit of the condensin complex; required for chromosome condensation and for clustering of tRNA genes at the nucleolus; may influence multiple aspects of chromosome transmission,NA,1 A_3
MATa-YCL004W,Mat-a,23412,YCL004W,S000000510,850352,PGS1,"Phosphatidylglycerolphosphate synthase, catalyzes the synthesis of phosphatidylglycerolphosphate from CDP-diacylglycerol and sn-glycerol 3-phosphate in the first committed and rate-limiting step of cardiolipin biosynthesis",NA,1 A_9
MATa-YDL058W,Mat-a,NA,YDL058W,NA,NA,USO1,NA,NA,1 A_10
MATa-YDL084W,Mat-a,23781,YDL084W,S000002242,851475,SUB2,Component of the TREX complex required for nuclear mRNA export; member of the DEAD-box RNA helicase superfamily and is involved in early and late steps of spliceosome assembly; homolog of the human splicing factor hUAP56; relocalizes from nucleus to cytoplasm upon DNA replication stress,NA,1 A_11
MATa-YDL132W,Mat-a,23829,YDL132W,S000002290,851424,CDC53,"Cullin, structural protein of SCF complexes (which also contain Skp1p, Cdc34p, Hrt1p and an F-box protein) involved in ubiquitination; SCF promotes the G1-S transition by targeting G1 cyclins and the Cln-CDK inhibitor Sic1p for degradation",NA,1 A_12
MATa-YDL140C,Mat-a,23838,YDL140C,S000002299,851415,RPO21,"RNA polymerase II largest subunit B220, part of central core; phosphorylation of C-terminal heptapeptide repeat domain regulates association with transcription and splicing factors; similar to bacterial beta-prime",NA,1 B_1
MATa-YDR050C,Mat-a,23986,YDR050C,S000002457,851620,TPI1,"Triose phosphate isomerase, abundant glycolytic enzyme; mRNA half-life is regulated by iron availability; transcription is controlled by activators Reb1p, Gcr1p, and Rap1p through binding sites in the 5' non-coding region; inhibition of Tpi1p activity by PEP (phosphoenolpyruvate) stimulates redox metabolism in respiring cells; E104D mutation in human TPI causes a rare autosomal disease",NA,1 B_3
MATa-YDR088C,Mat-a,24023,YDR088C,S000002495,851661,SLU7,"RNA splicing factor, required for ATP-independent portion of 2nd catalytic step of spliceosomal RNA splicing; interacts with Prp18p; contains zinc knuckle domain",NA,1 B_4
MATa-YDR145W,Mat-a,24079,YDR145W,S000002552,851723,TAF12,"Subunit (61/68 kDa) of TFIID and SAGA complexes, involved in RNA polymerase II transcription initiation and in chromatin modification, similar to histone H2A",NA,1 B_5
MATa-YDR303C,Mat-a,23662,YDR303C,S000002711,851897,RSC3,"Component of the RSC chromatin remodeling complex; essential gene required for maintenance of proper ploidy and regulation of ribosomal protein genes and the cell wall/stress response; RSC3 has a paralog, RSC30, that arose from the whole genome duplication",NA,1 B_6
MATa-YDR325W,Mat-a,23684,YDR325W,S000002733,851925,YCG1,"Subunit of the condensin complex; required for establishment and maintenance of chromosome condensation, chromosome segregation and chromatin binding of the condensin complex; required for clustering of tRNA genes at the nucleolus; required for replication slow zone (RSZ) breakage following Mec1p inactivation",NA,1 B_7
MATa-YEL055C,Mat-a,20296,YEL055C,S000000781,856655,POL5,"DNA Polymerase phi; has sequence similarity to the human MybBP1A and weak sequence similarity to B-type DNA polymerases, not required for chromosomal DNA replication; required for the synthesis of rRNA",NA,1 B_12
MATa-YER006W,Mat-a,20327,YER006W,S000000808,856723,NUG1,"GTPase that associates with nuclear 60S pre-ribosomes, required for export of 60S ribosomal subunits from the nucleus",NA,1 C_1
MATa-YER021W,Mat-a,20153,YER021W,S000000823,856742,RPN3,"Essential, non-ATPase regulatory subunit of the 26S proteasome lid, similar to the p58 subunit of the human 26S proteasome; temperature-sensitive alleles cause metaphase arrest, suggesting a role for the proteasome in cell cycle control",NA,1 C_3
MATa-YER022W,Mat-a,20154,YER022W,S000000824,856743,SRB4,Subunit of the RNA polymerase II mediator complex; associates with core polymerase subunits to form the RNA polymerase II holoenzyme; essential for transcriptional regulation; homozygosity of the human MED17 L371P mutation is associated with infantile cerebral and cerebellar atrophy with poor myelination,NA,1 C_4
MATa-YER168C,Mat-a,26164,YER168C,S000000970,856915,CCA1,"ATP (CTP):tRNA-specific tRNA nucleotidyltransferase; different forms targeted to the nucleus, cytosol, and mitochondrion are generated via the use of multiple transcriptional and translational start sites",NA,1 C_8
MATa-YFL038C,Mat-a,25659,YFL038C,S000001856,850505,YPT1,"Rab family GTPase, involved in the ER-to-Golgi step of the secretory pathway; complex formation with the Rab escort protein Mrs6p is required for prenylation of Ypt1p by protein geranylgeranyltransferase type II (Bet2p-Bet4p)",NA,1 D_1
MATa-YFR002W,Mat-a,NA,YFR002W,NA,NA,NIC96,NA,NA,1 D_2
MATa-YFR004W,Mat-a,25683,YFR004W,S000001900,850554,RPN11,"Metalloprotease subunit of the 19S regulatory particle of the 26S proteasome lid; couples the deubiquitination and degradation of proteasome substrates; involved, independent of catalytic activity, in fission of mitochondria and peroxisomes; protein abundance increases in response to DNA replication stress",NA,1 D_3
MATa-YFR031C,Mat-a,27086,YFR031C,S000001927,850589,SMC2,Subunit of the condensin complex; essential SMC chromosomal ATPase family member that forms a complex with Smc4p to form the active ATPase; Smc2p/Smc4p complex binds DNA; required for clustering of tRNA genes at the nucleolus,NA,1 D_4
MATa-YFR051C,Mat-a,25865,YFR051C,S000001947,850612,RET2,"Delta subunit of the coatomer complex (COPI), which coats Golgi-derived transport vesicles; involved in retrograde transport between Golgi and ER",NA,1 D_5
MATa-YGL044C,Mat-a,24412,YGL044C,S000003012,852838,RNA15,"Component of the cleavage and polyadenylation factor I (CF I); CF 1, composed of the CF 1A complex (Rna14p, Rna15p, Clp1p, Pcf11p) and Hrp1, is involved in cleavage and polyadenylation of mRNA 3' ends; interacts with the A-rich polyadenylation signal in complex with Rna14p and Hrp1p; mutant displays reduced transcription elongation in the G-less-based run-on (GLRO) assay; required for gene looping",NA,1 D_6
MATa-YGL055W,Mat-a,24422,YGL055W,S000003023,852825,OLE1,"Delta(9) fatty acid desaturase, required for monounsaturated fatty acid synthesis and for normal distribution of mitochondria",NA,1 D_7
MATa-YGL065C,Mat-a,24432,YGL065C,S000003033,852815,ALG2,Mannosyltransferase that catalyzes two consecutive steps in the N-linked glycosylation pathway; alg2 mutants exhibit temperature-sensitive growth and abnormal accumulation of the lipid-linked oligosaccharide Man2GlcNAc2-PP-Dol,NA,1 D_8
MATa-YGL073W,Mat-a,24440,YGL073W,S000003041,852806,HSF1,"Trimeric heat shock transcription factor; activates multiple genes in response to highly diverse stresses, including hyperthermia; recognizes variable heat shock elements (HSEs) consisting of inverted NGAAN repeats; monitors translational status of cell at the ribosome through an RQC (Ribosomal Quality Control)-mediated translation-stress signal; posttranslationally regulated",NA,1 D_9
MATa-YGL075C,Mat-a,24442,YGL075C,S000003043,852805,MPS2,"Essential membrane protein localized at nuclear envelope and SPBs; required for insertion of the newly duplicated spindle pole body into the nuclear envelope; potentially phosphorylated by Cdc28p; MPS2 has a paralog, CSM4, that arose from the whole genome duplication",NA,1 D_10
MATa-YGL098W,Mat-a,24465,YGL098W,S000003066,852780,USE1,"Essential SNARE protein localized to the ER, involved in retrograde traffic from the Golgi to the ER; forms a complex with the SNAREs Sec22p, Sec20p and Ufe1p",NA,1 D_12
MATa-YGL099W,Mat-a,24466,YGL099W,S000003067,852779,LSG1,Putative GTPase involved in 60S ribosomal subunit biogenesis; required for the release of Nmd3p from 60S subunits in the cytoplasm,NA,1 E_1
MATa-YGL120C,Mat-a,24487,YGL120C,S000003088,852757,PRP43,"RNA helicase in the DEAH-box family; functions in both RNA polymerase I and polymerase II transcript metabolism; catalyzes removal of U2, U5, and U6 snRNPs from the postsplicing lariat-intron ribonucleoprotein complex; required for efficient biogenesis of both small- and large-subunit rRNAs; acts with Sqs1p to promote 20S to 18S rRNA processing catalyzed by endonuclease Nob1p",NA,1 E_3
MATa-YGR075C,Mat-a,24705,YGR075C,S000003307,852966,PRP38,"Unique component of the U4/U6.U5 tri-snRNP particle, required for conformational changes which result in the catalytic activation of the spliceosome; dispensible for spliceosome assembly",NA,1 E_6
MATa-YGR116W,Mat-a,26994,YGR116W,S000003348,853011,SPT6,"Nucleosome remodeling protein; functions in various aspects of transcription, chromatin maintenance, and RNA processing; required for the maintenance of chromatin structure during transcription in order to inhibit transcription from promoters within the coding region",NA,1 E_9
MATa-YGR147C,Mat-a,24777,YGR147C,S000003379,853050,NAT2,Protein with an apparent role in acetylation of N-terminal methionine residues,NA,1 E_10
MATa-YGR158C,Mat-a,24788,YGR158C,S000003390,853062,MTR3,Exosome non-catalytic core component; involved in 3'-5' RNA processing and degradation in both the nucleus and the cytoplasm; has similarity to E. coli RNase PH and to human hMtr3p (EXOSC6),NA,1 E_12
MATa-YGR245C,Mat-a,25898,YGR245C,S000003477,853160,SDA1,"Highly conserved nuclear protein required for actin cytoskeleton organization and passage through Start, plays a critical role in G1 events, binds Nap1p, also involved in 60S ribosome biogenesis",NA,1 F_4
MATa-YHR170W,Mat-a,26418,YHR170W,S000001213,856575,NMD3,Protein involved in nuclear export of the large ribosomal subunit; acts as a Crm1p-dependent adapter protein for export of nascent ribosomal subunits through the nuclear pore complex,NA,1 F_9
MATa-YIL021W,Mat-a,21414,YIL021W,S000001283,854791,RPB3,"RNA polymerase II third largest subunit B44, part of central core; similar to prokaryotic alpha subunit",NA,1 F_12
MATa-YIL046W,Mat-a,21439,YIL046W,S000001308,854765,MET30,"F-box protein containing five copies of the WD40 motif, controls cell cycle function, sulfur metabolism, and methionine biosynthesis as part of the ubiquitin ligase complex; interacts with and regulates Met4p, localizes within the nucleus",NA,1 G_1
MATa-YIL078W,Mat-a,21471,YIL078W,S000001340,854732,THS1,"Threonyl-tRNA synthetase, essential cytoplasmic protein",NA,1 G_2
MATa-YIL126W,Mat-a,22285,YIL126W,S000001388,854680,STH1,ATPase component of the RSC chromatin remodeling complex; required for expression of early meiotic genes; essential helicase-related protein homologous to Snf2p,NA,1 G_4
MATa-YIL142W,Mat-a,22301,YIL142W,S000001404,854664,CCT2,"Subunit beta of the cytosolic chaperonin Cct ring complex, related to Tcp1p, required for the assembly of actin and tubulins in vivo",NA,1 G_5
MATa-YIR010W,Mat-a,22346,YIR010W,S000001449,854827,DSN1,Essential component of the MIND kinetochore complex (Mtw1p Including Nnf1p-Nsl1p-Dsn1p) which joins kinetochore subunits contacting DNA to those contacting microtubules; important for chromosome segregation,NA,1 G_7
MATa-YIR012W,Mat-a,22348,YIR012W,S000001451,854829,SQT1,Protein involved in 60S ribosomal subunit assembly or modification; contains multiple WD repeats; interacts with Qsr1p in a two-hybrid assay; protein abundance increases in response to DNA replication stress,NA,1 G_8
MATa-YJL014W,Mat-a,26782,YJL014W,S000003551,853438,CCT3,"Subunit of the cytosolic chaperonin Cct ring complex, related to Tcp1p, required for the assembly of actin and tubulins in vivo",NA,1 G_9
MATa-YJL076W,Mat-a,21347,YJL076W,S000003612,853369,NET1,"Core subunit of the RENT complex; involved in nucleolar silencing and telophase exit; stimulates transcription by RNA polymerase I and regulates nucleolar structure; NET1 has a paralog, TOF2, that arose from the whole genome duplication",NA,1 H_2
MATa-YJR112W,Mat-a,26917,YJR112W,S000003873,853576,NNF1,Essential component of the MIND kinetochore complex (Mtw1p Including Nnf1p-Nsl1p-Dsn1p) which joins kinetochore subunits contacting DNA to those contacting microtubules; required for accurate chromosome segregation,NA,1 H_4
MATa-YKL042W,Mat-a,24891,YKL042W,S000001525,853824,SPC42,"Central plaque component of spindle pole body (SPB); involved in SPB duplication, may facilitate attachment of the SPB to the nuclear membrane",NA,1 H_5
MATa-YKL059C,Mat-a,24908,YKL059C,S000001542,853806,MPE1,"Essential conserved subunit of CPF cleavage and polyadenylation factor; plays a role in 3' end formation of mRNA via the specific cleavage and polyadenylation of pre-mRNA, contains a putative RNA-binding zinc knuckle motif; relocalizes to the cytosol in response to hypoxia",NA,1 H_7
MATa-YKL125W,Mat-a,24975,YKL125W,S000001608,853734,RRN3,Protein required for transcription of rDNA by RNA polymerase I; transcription factor independent of DNA template; involved in recruitment of RNA polymerase I to rDNA; structure reveals unique HEAT repeat fold and a surface serine patch; phosphorylation of serine patch impairs cell growth and reduces RNA polymerase I binding in vitro and RNA polymerase I recruitment to the rDNA gene in vivo,NA,1 H_8
MATa-YKL172W,Mat-a,25022,YKL172W,S000001655,853682,EBP2,"Required for 25S rRNA maturation and 60S ribosomal subunit assembly; localizes to the nucleolus and in foci along nuclear periphery; constituent of 66S pre-ribosomal particles; cooperates with Rrs1p and Mps3p to mediate telomere clustering by binding Sir4p, but is not involved in telomere tethering",NA,1 H_10
MATa-YKL173W,Mat-a,25023,YKL173W,S000001656,853681,SNU114,GTPase component of U5 snRNP involved in mRNA splicing via spliceosome; binds directly to U5 snRNA; proposed to be involved in conformational changes of the spliceosome; similarity to ribosomal translocation factor EF-2,NA,1 H_11
MATa-YKL196C,Mat-a,25046,YKL196C,S000001679,853638,YKT6,"Vesicle membrane protein (v-SNARE) with acyltransferase activity; involved in trafficking to and within the Golgi, endocytic trafficking to the vacuole, and vacuolar fusion; membrane localization due to prenylation at the carboxy-terminus",NA,1 H_12
MATa-YKR008W,Mat-a,25079,YKR008W,S000001716,853877,RSC4,"Component of the RSC chromatin remodeling complex; found in close proximity to nucleosomal DNA; displaced from the surface of nucleosomal DNA after chromatin remodeling; acetylated (K25) by Gcn5p, altering replication stress tolerance; contains tandem bromodomains that recognize histone H3 acetylated on K14 (H3K14ac) by Gcn5p",NA,2 A_1
MATa-YKR037C,Mat-a,25108,YKR037C,S000001745,853909,SPC34,"Essential subunit of the Dam1 complex (aka DASH complex), couples kinetochores to the force produced by MT depolymerization thereby aiding in chromosome segregation; also localized to nuclear side of spindle pole body",NA,2 A_2
MATa-YKR083C,Mat-a,25999,YKR083C,S000001791,853958,DAD2,"Essential subunit of the Dam1 complex (aka DASH complex), couples kinetochores to the force produced by MT depolymerization thereby aiding in chromosome segregation; is transferred to the kinetochore prior to mitosis",NA,2 A_3
MATa-YLL003W,Mat-a,21491,YLL003W,S000003926,850657,SFI1,"Centrin (Cdc31p)-binding protein required for spindle pole body (SPB) duplication, localizes to the half-bridge of the SPB, required for progression through G(2)-M transition, has similarity to Xenopus laevis XCAP-C",NA,2 A_5
MATa-YLL008W,Mat-a,21496,YLL008W,S000003931,850652,DRS1,"Nucleolar DEAD-box protein required for ribosome assembly and function, including synthesis of 60S ribosomal subunits; constituent of 66S pre-ribosomal particles",NA,2 A_6
MATa-YLL034C,Mat-a,21522,YLL034C,S000003957,850625,RIX7,"Putative ATPase of the AAA family, required for export of pre-ribosomal large subunits from the nucleus; distributed between the nucleolus, nucleoplasm, and nuclear periphery depending on growth conditions",NA,2 A_7
MATa-YLR008C,Mat-a,21563,YLR008C,S000003998,850694,PAM18,Constituent of the import motor (PAM complex) component of the Translocase of the Inner Mitochondrial membrane (TIM23 complex); essential J-protein cochaperone that stimulates Ssc1p ATPase activity to drive import; inhibited by Pam16p,NA,2 A_8
MATa-YLR163C,Mat-a,24112,YLR163C,S000004153,850860,MAS1,"Smaller subunit of the mitochondrial processing protease (MPP), essential processing enzyme that cleaves the N-terminal targeting sequences from mitochondrially imported proteins",NA,2 A_11
MATa-YLR175W,Mat-a,24124,YLR175W,S000004165,850872,CBF5,"Pseudouridine synthase catalytic subunit of box H/ACA small nucleolar ribonucleoprotein particles (snoRNPs), acts on both large and small rRNAs and on snRNA U2; mutations in human ortholog dyskerin cause the disorder dyskeratosis congenita",NA,2 A_12
MATa-YLR272C,Mat-a,25181,YLR272C,S000004262,850977,YCS4,"Subunit of the condensin complex; required for establishment and maintenance of chromosome condensation, chromosome segregation, chromatin binding of condensin, tRNA gene clustering at the nucleolus, and silencing at the mating type locus; required for replication slow zone (RSZ) breakage following Mec1p inactivation",NA,2 B_2
MATa-YLR277C,Mat-a,25186,YLR277C,S000004267,850983,YSH1,"Putative endoribonuclease; subunit of the mRNA cleavage and polyadenylation specificity complex; required for 3' processing, splicing, and transcriptional termination of mRNAs and snoRNAs; protein abundance increases in response to DNA replication stress; YSH1 has a paralog, SYC1, that arose from the whole genome duplication",NA,2 B_3
MATa-YLR298C,Mat-a,25208,YLR298C,S000004289,851005,YHC1,"Component of the U1 snRNP complex required for pre-mRNA splicing; putative ortholog of human U1C protein, which is involved in formation of a complex between U1 snRNP and the pre-mRNA 5' splice site",NA,2 B_4
MATa-YML015C,Mat-a,20558,YML015C,S000004477,854993,TAF11,"TFIID subunit (40 kDa), involved in RNA polymerase II transcription initiation, similar to histone H3 with atypical histone fold motif of Spt3-like transcription factors",NA,2 B_5
MATa-YML046W,Mat-a,26951,YML046W,S000004509,854960,PRP39,"U1 snRNP protein involved in splicing, contains multiple tetriatricopeptide repeats",NA,2 B_6
MATa-YML049C,Mat-a,20522,YML049C,S000004513,854956,RSE1,Protein involved in pre-mRNA splicing; component of the pre-spliceosome; associates with U2 snRNA; involved in ER to Golgi transport,NA,2 B_7
MATa-YML098W,Mat-a,26496,YML098W,S000004564,854875,TAF13,"TFIID subunit (19 kDa), involved in RNA polymerase II transcription initiation, similar to histone H4 with atypical histone fold motif of Spt3-like transcription factors",NA,2 B_10
MATa-YML114C,Mat-a,26514,YML114C,S000004582,854926,TAF8,"TFIID subunit (65 kDa), involved in RNA polymerase II transcription initiation",NA,2 B_11
MATa-YMR005W,Mat-a,20580,YMR005W,S000004607,855017,TAF4,"TFIID subunit (48 kDa), involved in RNA polymerase II transcription initiation; potential Cdc28p substrate",NA,2 B_12
MATa-YMR043W,Mat-a,20619,YMR043W,S000004646,855060,MCM1,Transcription factor involved in cell-type-specific transcription and pheromone response; plays a central role in the formation of both repressor and activator complexes; relocalizes to the cytosol in response to hypoxia,NA,2 C_2
MATa-YMR061W,Mat-a,26194,YMR061W,S000004665,855083,RNA14,"Component of the cleavage and polyadenylation factor I (CF I); CF 1, composed of the CF 1A complex (Rna14p, Rna15p, Clp1p, Pcf11p) and Hrp1, is involved in cleavage and polyadenylation of mRNA 3' ends; bridges interaction between Rna15p and Hrp1p in the CF I complex; mutant displays reduced transcription elongation in the G-less-based run-on (GLRO) assay; required for gene looping; relocalizes to the cytosol in response to hypoxia",NA,2 C_3
MATa-YMR146C,Mat-a,20727,YMR146C,S000004754,855177,TIF34,"eIF3i subunit of the core complex of translation initiation factor 3 (eIF3), which is essential for translation; stimulates rate of ribosomal scanning during translation reinitiation",NA,2 C_4
MATa-YMR197C,Mat-a,20783,YMR197C,S000004810,855237,VTI1,"Protein involved in cis-Golgi membrane traffic; v-SNARE that interacts with two t-SNARES, Sed5p and Pep12p; required for multiple vacuolar sorting pathways",NA,2 C_5
MATa-YMR203W,Mat-a,20789,YMR203W,S000004816,855243,TOM40,"Component of the TOM (translocase of outer membrane) complex; responsible for recognition and initial import steps for all mitochondrially directed proteins; constitutes the core element of the protein conducting pore; pre-Tom40p is phosphorylated by PKA, which impairs its import into mitochondria under non-respiratory conditions",NA,2 C_6
MATa-YMR227C,Mat-a,20813,YMR227C,S000004840,855267,TAF7,"TFIID subunit (67 kDa), involved in RNA polymerase II transcription initiation",NA,2 C_7
MATa-YMR239C,Mat-a,20825,YMR239C,S000004852,855280,RNT1,"Nuclear dsRNA-specific ribonuclease (RNase III); involved in rDNA transcription, rRNA processing and U2 snRNA 3' end formation by cleavage of a stem-loop structure at the 3' end of U2 snRNA; involved in polyadenylation-independent transcription termination; involved in the cell wall stress response, regulating the degradation of cell wall integrity and morphogenesis checkpoint genes",NA,2 C_8
MATa-YMR270C,Mat-a,20856,YMR270C,S000004883,855312,RRN9,"Protein involved in promoting high level transcription of rDNA, subunit of UAF (upstream activation factor) for RNA polymerase I",NA,2 C_9
MATa-YMR277W,Mat-a,20863,YMR277W,S000004890,855320,FCP1,Carboxy-terminal domain (CTD) phosphatase; essential for dephosphorylation of the repeated C-terminal domain of the RNA polymerase II large subunit (Rpo21p); relocalizes to the cytosol in response to hypoxia,NA,2 C_10
MATa-YNL007C,Mat-a,25335,YNL007C,S000004952,855725,SIS1,Type II HSP40 co-chaperone that interacts with the HSP70 protein Ssa1p; not functionally redundant with Ydj1p due to due to substrate specificity; has similarity to bacterial DnaJ proteins; protein abundance increases in response to DNA replication stress,NA,2 C_11
MATa-YNL026W,Mat-a,25352,YNL026W,S000004971,855705,SAM50,"Essential component of the Sorting and Assembly Machinery (SAM or TOB complex) of the mitochondrial outer membrane, which binds precursors of beta-barrel proteins and facilitates their outer membrane insertion; homologous to bacterial Omp85",NA,2 C_12
MATa-YNL188W,Mat-a,22024,YNL188W,S000005132,855533,KAR1,"Essential protein involved in karyogamy during mating and in spindle pole body duplication during mitosis, localizes to the half-bridge of the spindle pole body, interacts with Spc72p during karyogamy, also interacts with Cdc31p",NA,2 D_2
MATa-YNL189W,Mat-a,22023,YNL189W,S000005133,855532,SRP1,"Karyopherin alpha homolog, forms a dimer with karyopherin beta Kap95p to mediate import of nuclear proteins, binds the nuclear localization signal of the substrate during import; may also play a role in regulation of protein degradation",NA,2 D_3
MATa-YNL221C,Mat-a,21991,YNL221C,S000005165,855500,POP1,"Subunit of both RNase MRP and nuclear RNase P; RNase MRP cleaves pre-rRNA, while nuclear RNase P cleaves tRNA precursors to generate mature 5' ends and facilitates turnover of nuclear RNAs; binds to the RPR1 RNA subunit in RNase P",NA,2 D_4
MATa-YNL251C,Mat-a,21193,YNL251C,S000005195,855470,NRD1,"RNA-binding protein, subunit of Nrd1 complex (Nrd1p-Nab3p-Sen1p); complex interacts with the exosome to mediate 3&#8242; end formation of some mRNAs, snRNAs, snoRNAs, and CUTs; interacts with the C-terminal domain of the RNA polymerase II large subunit (Rpo21p), preferentially at phosphorylated Ser5, to direct transcription termination of non-polyadenylated transcripts; H3K4 trimethylation of transcribed regions by Set1p enhances recruitment of Nrd1p to those sites",NA,2 D_5
MATa-YNL261W,Mat-a,21183,YNL261W,S000005205,855460,ORC5,"Subunit of the origin recognition complex, which directs DNA replication by binding to replication origins and is also involved in transcriptional silencing",NA,2 D_6
MATa-YNR016C,Mat-a,25391,YNR016C,S000005299,855750,ACC1,"Acetyl-CoA carboxylase, biotin containing enzyme; catalyzes carboxylation of cytosolic acetyl-CoA to form malonyl-CoA and regulates histone acetylation by regulating the availablity of acetyl-CoA; required for de novo biosynthesis of long-chain fatty acids; ACC1 has a paralog, HFA1, that arose from the whole genome duplication",NA,2 D_7
MATa-YNR035C,Mat-a,25410,YNR035C,S000005318,855771,ARC35,"Subunit of the ARP2/3 complex, which is required for the motility and integrity of cortical actin patches; required for cortical localization of calmodulin",NA,2 D_8
MATa-YNR043W,Mat-a,25418,YNR043W,S000005326,855779,MVD1,"Mevalonate pyrophosphate decarboxylase, essential enzyme involved in the biosynthesis of isoprenoids and sterols, including ergosterol; acts as a homodimer",NA,2 D_9
MATa-YNR053C,Mat-a,26080,YNR053C,S000005336,855789,NOG2,Putative GTPase that associates with pre-60S ribosomal subunits in the nucleolus and is required for their nuclear export and maturation,NA,2 D_10
MATa-YOL123W,Mat-a,26273,YOL123W,S000005483,853997,HRP1,"Subunit of cleavage factor I, a five-subunit complex required for the cleavage and polyadenylation of pre-mRNA 3' ends; RRM-containing heteronuclear RNA binding protein and hnRNPA/B family member that binds to poly (A) signal sequences",NA,2 D_11
